{
  "schemaVersion": 1,
  "productId": "wego-travel-marketplace",
  "displayName": "Wego Travel Marketplace",
  "version": "0.1.0",
  "platformVersion": "0.1.0-SNAPSHOT",
  "requiredModules": [
    "platform.events",
    "platform.security",
    "platform.identity",
    "platform.transaction",
    "product.travel-marketplace"
  ],
  "requiredCapabilities": [
    "platform.authorization",
    "platform.identity-authentication",
    "platform.integration-events",
    "platform.transaction-boundary",
    "travel-marketplace.product-boundary"
  ]
}
