{
  "schemaVersion": 1,
  "productId": "wego-divers",
  "displayName": "Wego Divers",
  "version": "0.1.0",
  "platformVersion": "0.1.0-SNAPSHOT",
  "requiredModules": [
    "platform.events",
    "platform.security",
    "platform.identity",
    "platform.transaction",
    "product.divers",
    "product.hr",
    "product.accounting",
    "product.payroll"
  ],
  "requiredCapabilities": [
    "divers.product-boundary",
    "platform.authorization",
    "platform.identity-authentication",
    "platform.integration-events",
    "platform.transaction-boundary",
    "hr.product-boundary",
    "accounting.product-boundary",
    "payroll.product-boundary"
  ]
}
