{
  "schemaVersion": 1,
  "productId": "wego-tours-operator",
  "displayName": "Wego Tours Operator",
  "version": "0.1.0",
  "platformVersion": "0.1.0-SNAPSHOT",
  "requiredModules": [
    "platform.events",
    "platform.identity",
    "platform.security",
    "platform.transaction",
    "product.tours-operator"
  ],
  "requiredCapabilities": [
    "platform.authorization",
    "platform.identity-authentication",
    "platform.integration-events",
    "platform.transaction-boundary",
    "tours-operator.product-boundary"
  ]
}
